{"schema":"https://debz.dev/schema/exact-closure-lock-v3","version":3,"target_architecture":"arm64","request_sha256":"1111111111111111111111111111111111111111111111111111111111111111","policy_sha256":"2222222222222222222222222222222222222222222222222222222222222222","repositories":[{"id":"bbbbbbbbbbbbbbbbbbbbbbbbbbbbbbbbbbbbbbbbbbbbbbbbbbbbbbbbbbbbbbbb","snapshot_sha256":"7777777777777777777777777777777777777777777777777777777777777777","release_sha256":"8888888888888888888888888888888888888888888888888888888888888888","index_identity":{"primary":"sha256","digests":[{"algorithm":"sha256","digest":"9999999999999999999999999999999999999999999999999999999999999999"}]},"archive_binding":"signed_sha256_derived_sha512","signer_fingerprints":["41587f7db8c774bccf131416762f67a0b2c39de4"]}],"local_artifacts":[],"packages":[{"name":"base-files","version":"13.8+deb13u1","architecture":"arm64","origin":{"type":"authenticated_repository","repository_id":"bbbbbbbbbbbbbbbbbbbbbbbbbbbbbbbbbbbbbbbbbbbbbbbbbbbbbbbbbbbbbbbb","repository_snapshot_sha256":"7777777777777777777777777777777777777777777777777777777777777777"},"archive_identity":{"primary":"sha256","digests":[{"algorithm":"sha256","digest":"ce23dcf68d6a3f27a0fffeb809b0ae95ac67db8bf062bb0e2a478de2c48641e0"}]},"derived_archive_identity":{"provenance":"derived_from_signed_sha256","algorithm":"sha512","digest":"3b05ae0568db6b8592b83cfaba25d30f1abad8a5444716d7ca8103f0b7ce6ebd72de6436a71d337c0915ababed66304c4bc5b9f2c3bf50911ef2e64702d12f33"},"declared_size":28,"retention":"requested","dpkg_selection_hold":false}],"digest_sha256":"aac26d91eae7f40ef92f252065c85e0a2d4a3270febb8dc380e0b3be91b1d31f"}
