{"schema":"https://debz.dev/schema/exact-closure-lock-v3","version":3,"target_architecture":"amd64","request_sha256":"0000000000000000000000000000000000000000000000000000000000000000","policy_sha256":"1111111111111111111111111111111111111111111111111111111111111111","repositories":[],"local_artifacts":[{"artifact_id":{"algorithm":"sha512","digest":"33333333333333333333333333333333333333333333333333333333333333333333333333333333333333333333333333333333333333333333333333333333"},"archive_identity":{"primary":"sha512","digests":[{"algorithm":"sha256","digest":"2222222222222222222222222222222222222222222222222222222222222222"},{"algorithm":"sha512","digest":"33333333333333333333333333333333333333333333333333333333333333333333333333333333333333333333333333333333333333333333333333333333"}]},"size":1,"package":{"name":"seed","version":"1","architecture":"all"},"acquisition_url":"https://example.invalid/seed.deb","trust_mode":"pinned_content_digest"}],"packages":[{"name":"seed","version":"1","architecture":"all","origin":{"type":"local_artifact","artifact_id":{"algorithm":"sha512","digest":"33333333333333333333333333333333333333333333333333333333333333333333333333333333333333333333333333333333333333333333333333333333"},"archive_identity":{"primary":"sha512","digests":[{"algorithm":"sha256","digest":"2222222222222222222222222222222222222222222222222222222222222222"},{"algorithm":"sha512","digest":"33333333333333333333333333333333333333333333333333333333333333333333333333333333333333333333333333333333333333333333333333333333"}]},"size":1,"package":{"name":"seed","version":"1","architecture":"all"},"acquisition_url":"https://example.invalid/seed.deb","trust_mode":"pinned_content_digest"},"archive_identity":{"primary":"sha512","digests":[{"algorithm":"sha256","digest":"2222222222222222222222222222222222222222222222222222222222222222"},{"algorithm":"sha512","digest":"33333333333333333333333333333333333333333333333333333333333333333333333333333333333333333333333333333333333333333333333333333333"}]},"declared_size":1,"retention":"requested","dpkg_selection_hold":false}],"digest_sha256":"9d3535edadd65511998ac3e2b55707cd65860d4d72445879214eb387645c21eb"}
